✅ Java 21 environment configured (OpenJDK)
openjdk version "21.0.9" 2025-10-21
🚀 Derbent Playwright UI Test Suite
====================================
🧪 Running Menu Navigation Test...
==================================
This test will:
  1. Login to the application
  2. Browse all menu items
  3. Capture screenshots for each menu item
  4. Complete in under 1 minute
🔄 Installing Playwright browsers...
⚠️ Browser installation completed

🎯 Test Configuration:
   Browser mode: VISIBLE
   Console output: ENABLED
   Screenshots: ENABLED
   Slowdown: 0ms
   Viewport: 1920x1080

[[1;34mINFO[m] Scanning for projects...
[[1;34mINFO[m] 
[[1;34mINFO[m] [1m------------------------< [0;36mtech.derbent:derbent[0;1m >------------------------[m
[[1;34mINFO[m] [1mBuilding Derbent 1.0-SNAPSHOT[m
[[1;34mINFO[m] [1m--------------------------------[ jar ]---------------------------------[m
[[1;34mINFO[m] 
[[1;34mINFO[m] [1m--- [0;32mmaven-resources-plugin:3.3.1:resources[m [1m(default-resources)[m @ [36mderbent[0;1m ---[m
[[1;34mINFO[m] Copying 5 resources from src/main/resources to target/classes
[[1;34mINFO[m] Copying 7 resources from src/main/resources to target/classes
[[1;34mINFO[m] 
[[1;34mINFO[m] [1m--- [0;32mmaven-compiler-plugin:3.14.0:compile[m [1m(default-compile)[m @ [36mderbent[0;1m ---[m
[[1;34mINFO[m] Nothing to compile - all classes are up to date.
[[1;34mINFO[m] 
[[1;34mINFO[m] [1m--- [0;32mmaven-resources-plugin:3.3.1:testResources[m [1m(default-testResources)[m @ [36mderbent[0;1m ---[m
[[1;34mINFO[m] Copying 3 resources from src/test/resources to target/test-classes
[[1;34mINFO[m] 
[[1;34mINFO[m] [1m--- [0;32mmaven-compiler-plugin:3.14.0:testCompile[m [1m(default-testCompile)[m @ [36mderbent[0;1m ---[m
[[1;34mINFO[m] Nothing to compile - all classes are up to date.
[[1;34mINFO[m] 
[[1;34mINFO[m] [1m--- [0;32mmaven-surefire-plugin:3.5.3:test[m [1m(default-test)[m @ [36mderbent[0;1m ---[m
[[1;34mINFO[m] Using auto detected provider org.apache.maven.surefire.junitplatform.JUnitPlatformProvider
[[1;34mINFO[m] 
[[1;34mINFO[m] -------------------------------------------------------
[[1;34mINFO[m]  T E S T S
[[1;34mINFO[m] -------------------------------------------------------
[[1;34mINFO[m] Running automated_tests.tech.derbent.ui.automation.[1mCMenuNavigationTest[m
10:14:29.166 [main] INFO org.springframework.boot.devtools.restart.RestartApplicationListener -- Restart disabled due to System property 'spring.devtools.restart.enabled' being set to false
[33mWARN [0;39m ([36mPostProcessorRegistrationDelegate.java:437[0;39m) [35mpostProcessAfterInitialization[0;39m:[31mBean 'CLayoutService' of type [tech.derbent.base.session.service.CLayoutService] is not eligible for getting processed by all BeanPostProcessors (for example: not eligible for auto-proxying). Is this bean getting eagerly injected/applied to a currently created BeanPostProcessor [layoutServiceInjector]? Check the corresponding BeanPostProcessor declaration and its dependencies/advisors. If this bean does not have to be post-processed, declare it with ROLE_INFRASTRUCTURE.[0;39m [36mtrationDelegate$BeanPostProcessorChecker[0;39m
[33mWARN [0;39m ([36mDialectFactoryImpl.java:153[0;39m) [35mconstructDialect[0;39m:[31mHHH90000025: H2Dialect does not need to be specified explicitly using 'hibernate.dialect' (remove the property setting and it will be selected by default)[0;39m [36morg.hibernate.orm.deprecation           [0;39m
[33mWARN [0;39m ([36mJpaBaseConfiguration.java:258[0;39m) [35mopenEntityManagerInViewInterceptor[0;39m:[31mspring.jpa.open-in-view is enabled by default. Therefore, database queries may be performed during view rendering. Explicitly configure spring.jpa.open-in-view to disable this warning[0;39m [36mJpaBaseConfiguration$JpaWebConfiguration[0;39m
[33mWARN [0;39m ([36mInitializeUserDetailsBeanManagerConfigurer.java:87[0;39m) [35mconfigure[0;39m:[31mFound 2 UserDetailsService beans, with names [CUserService, userDetailsService]. Global Authentication Manager will not use a UserDetailsService for username/password login. Consider publishing a single UserDetailsService bean.[0;39m [36mr$InitializeUserDetailsManagerConfigurer[0;39m
[32mINFO [0;39m ([36mCEntityRegistryInitializer.java:23[0;39m) [35mregisterAll[0;39m:[31mFound 65 IEntityRegistrable beans to register[0;39m [36mt.d.a.r.CEntityRegistryInitializer      [0;39m
[32mINFO [0;39m ([36mCEntityRegistryInitializer.java:40[0;39m) [35mrun[0;39m:[31mEntity registry initialized successfully with 64 entities[0;39m [36mt.d.a.r.CEntityRegistryInitializer      [0;39m
Mockito is currently self-attaching to enable the inline-mock-maker. This will no longer work in future releases of the JDK. Please add Mockito as an agent to your build as described in Mockito's documentation: https://javadoc.io/doc/org.mockito/mockito-core/latest/org.mockito/org/mockito/Mockito.html#0.3
OpenJDK 64-Bit Server VM warning: Sharing is only supported for boot loader classes because bootstrap classpath has been appended
WARNING: A Java agent has been loaded dynamically (/home/yasin/.m2/repository/net/bytebuddy/byte-buddy-agent/1.17.5/byte-buddy-agent-1.17.5.jar)
WARNING: If a serviceability tool is in use, please run with -XX:+EnableDynamicAgentLoading to hide this warning
WARNING: If a serviceability tool is not in use, please run with -Djdk.instrument.traceUsage for more information
WARNING: Dynamic loading of agents will be disallowed by default in a future release
Skipping browsers download because `PLAYWRIGHT_SKIP_BROWSER_DOWNLOAD` env variable is set
[32mINFO [0;39m ([36mCCustomLoginView.java:133[0;39m) [35mon_buttonResetDb_clicked[0;39m:[31m🔄 Showing DB Full reset confirmation dialog...[0;39m [36mt.d.base.login.view.CCustomLoginView    [0;39m
[32mINFO [0;39m ([36mCCustomLoginView.java:178[0;39m) [35mrunDatabaseReset[0;39m:[31m✅ DB reset confirmed - starting database initialization...[0;39m [36mt.d.base.login.view.CCustomLoginView    [0;39m
[32mINFO [0;39m ([36mCDataInitializer.java:204[0;39m) [35m<init>[0;39m:[31mDataInitializer starting - obtaining service beans from application context[0;39m [36mt.derbent.api.config.CDataInitializer   [0;39m
[32mINFO [0;39m ([36mCDataInitializer.java:252[0;39m) [35m<init>[0;39m:[31mAll service beans obtained successfully[0;39m [36mt.derbent.api.config.CDataInitializer   [0;39m
[32mINFO [0;39m ([36mCCustomLoginView.java:236[0;39m) [35mrunDatabaseResetInSession[0;39m:[31m🔧 Using Derbent data initializer[0;39m [36mt.d.base.login.view.CCustomLoginView    [0;39m
[32mINFO [0;39m ([36mCDataInitializer.java:853[0;39m) [35mreloadForced[0;39m:[31mSample data reload (forced) started[0;39m [36mt.derbent.api.config.CDataInitializer   [0;39m
[32mINFO [0;39m ([36mCDataInitializer.java:320[0;39m) [35mclearSampleData[0;39m:[31mFallback JPA deleteAllInBatch completed.[0;39m [36mt.derbent.api.config.CDataInitializer   [0;39m
[32mINFO [0;39m ([36mCDataInitializer.java:702[0;39m) [35mloadSampleData[0;39m:[31mSetting active company to: id:1:Of Teknoloji Çözümleri[0;39m [36mt.derbent.api.config.CDataInitializer   [0;39m
[32mINFO [0;39m ([36mCKanbanLineInitializerService.java:145[0;39m) [35minitializeSample[0;39m:[31m[KanbanInit] Initializing sample kanban lines for company 'Of Teknoloji Çözümleri' (ID: 1)[0;39m [36m.d.a.k.k.s.CKanbanLineInitializerService[0;39m
[32mINFO [0;39m ([36mCKanbanLineInitializerService.java:180[0;39m) [35mlambda$initializeSample$0[0;39m:[31m[KanbanInit] Completed initialization of kanban line 'Scrum Board' with 4 columns[0;39m [36m.d.a.k.k.s.CKanbanLineInitializerService[0;39m
[32mINFO [0;39m ([36mCKanbanLineInitializerService.java:180[0;39m) [35mlambda$initializeSample$0[0;39m:[31m[KanbanInit] Completed initialization of kanban line 'Simple Kanban' with 3 columns[0;39m [36m.d.a.k.k.s.CKanbanLineInitializerService[0;39m
[32mINFO [0;39m ([36mCDataInitializer.java:725[0;39m) [35mloadSampleData[0;39m:[31mInitializing sample data for project: 1:Digital Transformation Initiative (company: 1:Of Teknoloji Çözümleri)[0;39m [36mt.derbent.api.config.CDataInitializer   [0;39m
[32mINFO [0;39m ([36mCOrderInitializerService.java:100[0;39m) [35minitializeSample[0;39m:[31mInitialized 2 sample orders for project Digital Transformation Initiative[0;39m [36mt.d.a.o.o.s.COrderInitializerService    [0;39m
[31mERROR[0;39m ([36mCEntityOfProjectService.java:240[0;39m) [35msave[0;39m:[31msave(entity=null) - Error saving entity: Validation failed for classes [tech.derbent.app.issues.issue.domain.CIssue] during persist time for groups [jakarta.validation.groups.Default, ]
List of constraint violations:[
	ConstraintViolationImpl{interpolatedMessage='Sprint item is required for progress tracking', propertyPath=sprintItem, rootBeanClass=class tech.derbent.app.issues.issue.domain.CIssue, messageTemplate='Sprint item is required for progress tracking'}
][0;39m [36mt.d.a.e.service.CEntityOfProjectService [0;39m
[31mERROR[0;39m ([36mCDataInitializer.java:847[0;39m) [35mloadSampleData[0;39m:[31mError loading sample data: Validation failed for classes [tech.derbent.app.issues.issue.domain.CIssue] during persist time for groups [jakarta.validation.groups.Default, ]
List of constraint violations:[
	ConstraintViolationImpl{interpolatedMessage='Sprint item is required for progress tracking', propertyPath=sprintItem, rootBeanClass=class tech.derbent.app.issues.issue.domain.CIssue, messageTemplate='Sprint item is required for progress tracking'}
][0;39m [36mt.derbent.api.config.CDataInitializer   [0;39m
[31mERROR[0;39m ([36mCCustomLoginView.java:187[0;39m) [35mlambda$runDatabaseReset$2[0;39m:[31m❌ DB reset failed[0;39m [36mt.d.base.login.view.CCustomLoginView    [0;39m
jakarta.validation.ConstraintViolationException: Validation failed for classes [tech.derbent.app.issues.issue.domain.CIssue] during persist time for groups [jakarta.validation.groups.Default, ]
List of constraint violations:[
	ConstraintViolationImpl{interpolatedMessage='Sprint item is required for progress tracking', propertyPath=sprintItem, rootBeanClass=class tech.derbent.app.issues.issue.domain.CIssue, messageTemplate='Sprint item is required for progress tracking'}
]
	at org.hibernate.boot.beanvalidation.BeanValidationEventListener.validate(BeanValidationEventListener.java:176) ~[hibernate-core-6.6.15.Final.jar:6.6.15.Final]
	at org.hibernate.boot.beanvalidation.BeanValidationEventListener.onPreInsert(BeanValidationEventListener.java:88) ~[hibernate-core-6.6.15.Final.jar:6.6.15.Final]
	at org.hibernate.action.internal.EntityIdentityInsertAction.preInsert(EntityIdentityInsertAction.java:201) ~[hibernate-core-6.6.15.Final.jar:6.6.15.Final]
	at org.hibernate.action.internal.EntityIdentityInsertAction.execute(EntityIdentityInsertAction.java:79) ~[hibernate-core-6.6.15.Final.jar:6.6.15.Final]
	at org.hibernate.engine.spi.ActionQueue.execute(ActionQueue.java:682) ~[hibernate-core-6.6.15.Final.jar:6.6.15.Final]
	at org.hibernate.engine.spi.ActionQueue.addResolvedEntityInsertAction(ActionQueue.java:293) ~[hibernate-core-6.6.15.Final.jar:6.6.15.Final]
	at org.hibernate.engine.spi.ActionQueue.addInsertAction(ActionQueue.java:274) ~[hibernate-core-6.6.15.Final.jar:6.6.15.Final]
	at org.hibernate.engine.spi.ActionQueue.addAction(ActionQueue.java:324) ~[hibernate-core-6.6.15.Final.jar:6.6.15.Final]
	at org.hibernate.event.internal.AbstractSaveEventListener.addInsertAction(AbstractSaveEventListener.java:394) ~[hibernate-core-6.6.15.Final.jar:6.6.15.Final]
	at org.hibernate.event.internal.AbstractSaveEventListener.performSaveOrReplicate(AbstractSaveEventListener.java:308) ~[hibernate-core-6.6.15.Final.jar:6.6.15.Final]
	at org.hibernate.event.internal.AbstractSaveEventListener.performSave(AbstractSaveEventListener.java:224) ~[hibernate-core-6.6.15.Final.jar:6.6.15.Final]
	at org.hibernate.event.internal.AbstractSaveEventListener.saveWithGeneratedId(AbstractSaveEventListener.java:136) ~[hibernate-core-6.6.15.Final.jar:6.6.15.Final]
	at org.hibernate.event.internal.DefaultPersistEventListener.entityIsTransient(DefaultPersistEventListener.java:177) ~[hibernate-core-6.6.15.Final.jar:6.6.15.Final]
	at org.hibernate.event.internal.DefaultPersistEventListener.persist(DefaultPersistEventListener.java:95) ~[hibernate-core-6.6.15.Final.jar:6.6.15.Final]
	at org.hibernate.event.internal.DefaultPersistEventListener.onPersist(DefaultPersistEventListener.java:79) ~[hibernate-core-6.6.15.Final.jar:6.6.15.Final]
	at org.hibernate.event.internal.DefaultPersistEventListener.onPersist(DefaultPersistEventListener.java:55) ~[hibernate-core-6.6.15.Final.jar:6.6.15.Final]
	at org.hibernate.event.service.internal.EventListenerGroupImpl.fireEventOnEachListener(EventListenerGroupImpl.java:127) ~[hibernate-core-6.6.15.Final.jar:6.6.15.Final]
	at org.hibernate.internal.SessionImpl.firePersist(SessionImpl.java:761) ~[hibernate-core-6.6.15.Final.jar:6.6.15.Final]
	at org.hibernate.internal.SessionImpl.persist(SessionImpl.java:745) ~[hibernate-core-6.6.15.Final.jar:6.6.15.Final]
	at java.base/jdk.internal.reflect.DirectMethodHandleAccessor.invoke(DirectMethodHandleAccessor.java:103) ~[na:na]
	at java.base/java.lang.reflect.Method.invoke(Method.java:580) ~[na:na]
	at org.springframework.orm.jpa.SharedEntityManagerCreator$SharedEntityManagerInvocationHandler.invoke(SharedEntityManagerCreator.java:320) ~[spring-orm-6.2.7.jar:6.2.7]
	at jdk.proxy2/jdk.proxy2.$Proxy223.persist(Unknown Source) ~[na:na]
	at org.springframework.data.jpa.repository.support.SimpleJpaRepository.save(SimpleJpaRepository.java:651) ~[spring-data-jpa-3.5.0.jar:3.5.0]
	at java.base/jdk.internal.reflect.DirectMethodHandleAccessor.invoke(DirectMethodHandleAccessor.java:103) ~[na:na]
	at java.base/java.lang.reflect.Method.invoke(Method.java:580) ~[na:na]
	at org.springframework.aop.support.AopUtils.invokeJoinpointUsingReflection(AopUtils.java:359) ~[spring-aop-6.2.7.jar:6.2.7]
	at org.springframework.data.repository.core.support.RepositoryMethodInvoker$RepositoryFragmentMethodInvoker.lambda$new$0(RepositoryMethodInvoker.java:277) ~[spring-data-commons-3.5.0.jar:3.5.0]
	at org.springframework.data.repository.core.support.RepositoryMethodInvoker.doInvoke(RepositoryMethodInvoker.java:170) ~[spring-data-commons-3.5.0.jar:3.5.0]
	at org.springframework.data.repository.core.support.RepositoryMethodInvoker.invoke(RepositoryMethodInvoker.java:158) ~[spring-data-commons-3.5.0.jar:3.5.0]
	at org.springframework.data.repository.core.support.RepositoryComposition$RepositoryFragments.invoke(RepositoryComposition.java:515) ~[spring-data-commons-3.5.0.jar:3.5.0]
	at org.springframework.data.repository.core.support.RepositoryComposition.invoke(RepositoryComposition.java:284) ~[spring-data-commons-3.5.0.jar:3.5.0]
	at org.springframework.data.repository.core.support.RepositoryFactorySupport$ImplementationMethodExecutionInterceptor.invoke(RepositoryFactorySupport.java:734) ~[spring-data-commons-3.5.0.jar:3.5.0]
	at org.springframework.aop.framework.ReflectiveMethodInvocation.proceed(ReflectiveMethodInvocation.java:184) ~[spring-aop-6.2.7.jar:6.2.7]
	at org.springframework.data.repository.core.support.QueryExecutorMethodInterceptor.doInvoke(QueryExecutorMethodInterceptor.java:174) ~[spring-data-commons-3.5.0.jar:3.5.0]
	at org.springframework.data.repository.core.support.QueryExecutorMethodInterceptor.invoke(QueryExecutorMethodInterceptor.java:149) ~[spring-data-commons-3.5.0.jar:3.5.0]
	at org.springframework.aop.framework.ReflectiveMethodInvocation.proceed(ReflectiveMethodInvocation.java:184) ~[spring-aop-6.2.7.jar:6.2.7]
	at org.springframework.data.projection.DefaultMethodInvokingMethodInterceptor.invoke(DefaultMethodInvokingMethodInterceptor.java:69) ~[spring-data-commons-3.5.0.jar:3.5.0]
	at org.springframework.aop.framework.ReflectiveMethodInvocation.proceed(ReflectiveMethodInvocation.java:184) ~[spring-aop-6.2.7.jar:6.2.7]
	at org.springframework.transaction.interceptor.TransactionAspectSupport.invokeWithinTransaction(TransactionAspectSupport.java:380) ~[spring-tx-6.2.7.jar:6.2.7]
	at org.springframework.transaction.interceptor.TransactionInterceptor.invoke(TransactionInterceptor.java:119) ~[spring-tx-6.2.7.jar:6.2.7]
	at org.springframework.aop.framework.ReflectiveMethodInvocation.proceed(ReflectiveMethodInvocation.java:184) ~[spring-aop-6.2.7.jar:6.2.7]
	at org.springframework.dao.support.PersistenceExceptionTranslationInterceptor.invoke(PersistenceExceptionTranslationInterceptor.java:138) ~[spring-tx-6.2.7.jar:6.2.7]
	at org.springframework.aop.framework.ReflectiveMethodInvocation.proceed(ReflectiveMethodInvocation.java:184) ~[spring-aop-6.2.7.jar:6.2.7]
	at org.springframework.data.jpa.repository.support.CrudMethodMetadataPostProcessor$CrudMethodMetadataPopulatingMethodInterceptor.invoke(CrudMethodMetadataPostProcessor.java:165) ~[spring-data-jpa-3.5.0.jar:3.5.0]
	at org.springframework.aop.framework.ReflectiveMethodInvocation.proceed(ReflectiveMethodInvocation.java:184) ~[spring-aop-6.2.7.jar:6.2.7]
	at org.springframework.aop.framework.JdkDynamicAopProxy.invoke(JdkDynamicAopProxy.java:223) ~[spring-aop-6.2.7.jar:6.2.7]
	at jdk.proxy2/jdk.proxy2.$Proxy268.save(Unknown Source) ~[na:na]
	at tech.derbent.api.entityOfProject.service.CEntityOfProjectService.save(CEntityOfProjectService.java:237) ~[classes/:na]
	at tech.derbent.app.issues.issue.service.CIssueService.save(CIssueService.java:94) ~[classes/:na]
	at java.base/jdk.internal.reflect.DirectMethodHandleAccessor.invoke(DirectMethodHandleAccessor.java:103) ~[na:na]
	at java.base/java.lang.reflect.Method.invoke(Method.java:580) ~[na:na]
	at org.springframework.aop.support.AopUtils.invokeJoinpointUsingReflection(AopUtils.java:359) ~[spring-aop-6.2.7.jar:6.2.7]
	at org.springframework.aop.framework.ReflectiveMethodInvocation.invokeJoinpoint(ReflectiveMethodInvocation.java:196) ~[spring-aop-6.2.7.jar:6.2.7]
	at org.springframework.aop.framework.ReflectiveMethodInvocation.proceed(ReflectiveMethodInvocation.java:163) ~[spring-aop-6.2.7.jar:6.2.7]
	at org.springframework.transaction.interceptor.TransactionAspectSupport.invokeWithinTransaction(TransactionAspectSupport.java:380) ~[spring-tx-6.2.7.jar:6.2.7]
	at org.springframework.transaction.interceptor.TransactionInterceptor.invoke(TransactionInterceptor.java:119) ~[spring-tx-6.2.7.jar:6.2.7]
	at org.springframework.aop.framework.ReflectiveMethodInvocation.proceed(ReflectiveMethodInvocation.java:184) ~[spring-aop-6.2.7.jar:6.2.7]
	at org.springframework.aop.framework.CglibAopProxy$DynamicAdvisedInterceptor.intercept(CglibAopProxy.java:728) ~[spring-aop-6.2.7.jar:6.2.7]
	at tech.derbent.app.issues.issue.service.CIssueService$$SpringCGLIB$$0.save(<generated>) ~[classes/:na]
	at tech.derbent.api.screens.service.CInitializerServiceBase.initializeProjectEntity(CInitializerServiceBase.java:255) ~[classes/:na]
	at tech.derbent.app.issues.issue.service.CIssueInitializerService.initializeSample(CIssueInitializerService.java:109) ~[classes/:na]
	at tech.derbent.api.config.CDataInitializer.loadSampleData(CDataInitializer.java:834) ~[classes/:na]
	at tech.derbent.api.config.CDataInitializer.reloadForced(CDataInitializer.java:855) ~[classes/:na]
	at tech.derbent.base.login.view.CCustomLoginView.runDatabaseResetInSession(CCustomLoginView.java:237) ~[classes/:na]
	at tech.derbent.base.login.view.CCustomLoginView.lambda$runDatabaseReset$2(CCustomLoginView.java:183) ~[classes/:na]
	at java.base/java.util.concurrent.CompletableFuture$AsyncRun.run(CompletableFuture.java:1804) ~[na:na]
	at java.base/java.util.concurrent.CompletableFuture$AsyncRun.exec(CompletableFuture.java:1796) ~[na:na]
	at java.base/java.util.concurrent.ForkJoinTask.doExec(ForkJoinTask.java:387) ~[na:na]
	at java.base/java.util.concurrent.ForkJoinPool$WorkQueue.topLevelExec(ForkJoinPool.java:1312) ~[na:na]
	at java.base/java.util.concurrent.ForkJoinPool.scan(ForkJoinPool.java:1843) ~[na:na]
	at java.base/java.util.concurrent.ForkJoinPool.runWorker(ForkJoinPool.java:1808) ~[na:na]
	at java.base/java.util.concurrent.ForkJoinWorkerThread.run(ForkJoinWorkerThread.java:188) ~[na:na]
[33mWARN [0;39m ([36mCBaseUITest.java:2215[0;39m) [35mwaitForOverlayToClose[0;39m:[31m⚠️ Overlay vaadin-dialog-overlay[opened] still present after waiting 5.0 seconds[0;39m [36ma.t.derbent.ui.automation.CBaseUITest   [0;39m
[[1;31mERROR[m] [1;31mTests [0;1mrun: [0;1m1[m, [1;31mFailures: [0;1;31m1[m, Errors: 0, Skipped: 0, Time elapsed: 36.48 s[1;31m <<< FAILURE![m -- in automated_tests.tech.derbent.ui.automation.[1mCMenuNavigationTest[m
[[1;31mERROR[m] automated_tests.tech.derbent.ui.automation.CMenuNavigationTest.testMenuNavigation -- Time elapsed: 19.74 s <<< FAILURE!
java.lang.AssertionError: Progress or information dialog did not appear after database reset
	at automated_tests.tech.derbent.ui.automation.CBaseUITest.waitForProgressDialogToComplete(CBaseUITest.java:2235)
	at automated_tests.tech.derbent.ui.automation.CBaseUITest.initializeSampleDataFromLoginPage(CBaseUITest.java:749)
	at automated_tests.tech.derbent.ui.automation.CBaseUITest.loginToApplication(CBaseUITest.java:891)
	at automated_tests.tech.derbent.ui.automation.CBaseUITest.loginToApplication(CBaseUITest.java:867)
	at automated_tests.tech.derbent.ui.automation.CMenuNavigationTest.testMenuNavigation(CMenuNavigationTest.java:155)
	at java.base/java.lang.reflect.Method.invoke(Method.java:580)
	at java.base/java.util.ArrayList.forEach(ArrayList.java:1596)
	at java.base/java.util.ArrayList.forEach(ArrayList.java:1596)

[[1;34mINFO[m] 
[[1;34mINFO[m] Results:
[[1;34mINFO[m] 
[[1;31mERROR[m] [1;31mFailures: [m
[[1;31mERROR[m] [1;31m  CMenuNavigationTest.testMenuNavigation:155->CBaseUITest.loginToApplication:867->CBaseUITest.loginToApplication:891->CBaseUITest.initializeSampleDataFromLoginPage:749->CBaseUITest.waitForProgressDialogToComplete:2235 Progress or information dialog did not appear after database reset[m
[[1;34mINFO[m] 
[[1;31mERROR[m] [1;31mTests run: 1, Failures: 1, Errors: 0, Skipped: 0[m
[[1;34mINFO[m] 
[[1;34mINFO[m] [1m------------------------------------------------------------------------[m
[[1;34mINFO[m] [1;31mBUILD FAILURE[m
[[1;34mINFO[m] [1m------------------------------------------------------------------------[m
[[1;34mINFO[m] Total time:  38.605 s
[[1;34mINFO[m] Finished at: 2026-01-15T10:15:05+03:00
[[1;34mINFO[m] [1m------------------------------------------------------------------------[m
[[1;31mERROR[m] Failed to execute goal [32morg.apache.maven.plugins:maven-surefire-plugin:3.5.3:test[m [1m(default-test)[m on project [36mderbent[m: [1;31mThere are test failures.[m
[[1;31mERROR[m] [1;31m[m
[[1;31mERROR[m] [1;31mSee /home/yasin/git/derbent/target/surefire-reports for the individual test results.[m
[[1;31mERROR[m] [1;31mSee dump files (if any exist) [date].dump, [date]-jvmRun[N].dump and [date].dumpstream.[m
[[1;31mERROR[m] -> [1m[Help 1][m
[[1;31mERROR[m] 
[[1;31mERROR[m] To see the full stack trace of the errors, re-run Maven with the [1m-e[m switch.
[[1;31mERROR[m] Re-run Maven using the [1m-X[m switch to enable full debug logging.
[[1;31mERROR[m] 
[[1;31mERROR[m] For more information about the errors and possible solutions, please read the following articles:
[[1;31mERROR[m] [1m[Help 1][m http://cwiki.apache.org/confluence/display/MAVEN/MojoFailureException
❌ Test failed!
📸 Debug screenshots available in target/screenshots/ (4 files)
